BookName,Category,Summary,Author
Semicolon ;,Poetry,A Collection of poetry that uncovers the raw and heavy emotions that come with anxiety  trauma  and other experiences. Part two takes you into the healing  bringing the light  the meditation  the beauty in finding oneself,McKayla Debonis* 
Hearts and Empires,Poetry,For everyone who have their hearts broken  their minds troubled  their spirits crushed  and their bodies trampled. Hearts and Empires is Cynthia Go’s first book,Cynthia Go
The Sun and Her Flowers,Poetry,From Rupi Kaur  the #1 New York Times bestselling author of milk and honey  comes her long-awaited second collection of poetry. A vibrant and transcendent journey about growth and healing.,Rupi Kaur
Long Way Down,Poetry,A cannon. A strap. A piece. A biscuit. A burner. A heater. A chopper. A gat. A hammer A tool for RULE Or  you can call it a gun. That’s what fifteen-year-old Will has shoved in the back waistband of his jeans.,Jason Reynolds 
Milk and Vine,Poetry,Parodying the popular poetry book Milk and Honey  Milk and Vine beautifully portrays the best vines of all time in this modern poetic format.,Adam Gasiewsk
Vanilla,Poetry,A bold  groundbreaking novel about coming out  coming into your own  and coming apart. Hunter and Van become boyfriends before they're even teenager,Billy Merrell 
The Lost Words,Poetry,From Acorn to Weasel: a gorgeous  hand-illustrated  large-format spellbook celebrating the magic and wonder of the natural world All over the country,Robert Macfarlane 
Advice from the Lights,Poetry,Stephen is sometimes Stephanie and sometimes wonders how his past and her past are their own collective memoryAdvice from the Lights is a brilliant and candid exploration,Stephen Burt
You Left me  sweets  two legacies,Poetry,"""love is more thicker than forget more thinner than recall more seldom than a wave is wet more frequent than to fail"" (E E Cummings) Love is always kind",Avira N
For Want of Water and Other Poems,Poetry,Searing verses set on the Mexican border about war and addiction  love and sexual violence  grief and loss  from an American Book Award-winning author.,Sasha Pimentel 
the magic my body becomes,Poetry,Winner  2017 Etel Adnan Poetry Prize In the magic my body becomes  Jess Rizkallah seeks a vernacular for the inescapable middle ground of being Arab American,Jess Rizkallah
Wish You Were Here,Poetry,Bloody Valentine's poetry :) Schizoid  violent  pornographic  heartbroken :-) Parental Advisory: Explicit Content :--) Party party party party all the time,Alexander Akyna
Wonder Woman Vol. 4,Comics,Princess Diana—Wonder Woman—is a hero to the world. But there are those who see her very differently. And one of those  Veronica Cale  the leader of the all-powerful Godwatch  ,Greg Rucka 
Titans: The Lazarus Contract,Comics,They are the greatest young heroes this world—or any world—has ever known. They are the Titans. And now  from the void between the worlds  one of their most legendary members has emerged. ,Christopher J. Priest 
The Flash Vol. 4,Comics,The Fastest Man Alive continues his monumental run in DC Universe Rebirth with THE FLASH VOL. 4! Barry Allen is at a crossroads. He’s lied to the woman he loves about his life as the Flash  and a rift is growing ,Joshua Williamson 
Penny Dreadful,Comics,Set six months after the shocking events of the Penny Dreadful season three TV finale. Written by Penny Dreadful TV series Co-Executive Producer Chris King,Chris King 
Captain Phasma,Comics,Set six months after the shocking events of the Penny Dreadful season three TV finale. Written by Penny Dreadful TV series Co-Executive Producer Chris King.,Kelly Thompson
Black Panther,Comics,"""YOU DESERVED SO MUCH MORE  LITTLE FLOWER. YOU DESERVED A WAKANDA THAT CHERISHED YOU."" Writer ROXANE GAY (Bad Feminst  Hunger) spins a Wakandan love story ",Roxane Gay
Runaways,Comics,The Runaways' recruitment road trip stops at Pomona College  where Karolina Dean is finally happy. Chase  Nico and Gert have nothing to lose:,Rainbow Rowell
Cici's Journal,Comics,Cici dreams of being a novelist. Her favorite subject: people  especially adults. She’s been watching them and taking notes. Everybody has one special secret,Joris Chamblain 
Rose,Comics,A classic fantasy tale about a girl trying to restore balance to a broken world. Rose must connect with her Khat--Thorne--to become the Guardian the world needs. But things aren't easy for Rose and Thorne  the powerful,Meredith Finch 
Regression  Vol,Comics,Plagued by ghastly waking nightmares  Adrian reluctantly agrees to past life regression hypnotherapy. As his consciousness is cast back through time,Cullen Bunn
Ghost Fleet,Comics,For the world’s most valuable  dangerous  or secretive cargo  you don’t call just any trucking service...you call THE GHOST FLEET,Donny Cates 
Eternal Empire  Vol. 1,Comics,JONATHAN LUNA (ALEX + ADA  THE SWORD  Spider-Woman: Origin) and SARAH VAUGHN (ALEX + ADA  Deadman: Dark Mansion of Forbidden Love,Sarah Vaughn 
Legend Lost,Comics,It's a sad day for Poe Dameron and the Resistance  as they mourn the loss of a fallen comrade. But their fight is far from over - the First Order must be stopped,Charles Soule 
Jughead  Vol. 3,Comics,It's magic  music  mayhem and ZOMBIES (oh yeah  and hamburgers -- plenty of hamburgers!) in this third volume,Ryan North 
Demon  Volume 4,Comics,Immortal actuary Jimmy makes a startling discovery: Agent Hunter  his long-dead adversary  is actually alive and a demon himself! ,Jason Shiga 
Black Panther Book 4,Comics,Where next for the Black Panther? Find out as a sensational new arc begins! Eons ago - before Black Panthers  before Wakanda  before time itself ,Ta-Nehisi Coates 
Paper Girls: Book One,Comics,From BRIAN K. VAUGHAN  New York Times bestselling writer of SAGA  and CLIFF CHIANG  legendary artist of Wonder Woman  this gorgeous oversized deluxe,Brian K. Vaughan 
Goldie Vance Vol. 3,Comics,Catch up with the coolest new girl detective on the block  Goldie Vance.Sixteen-year-old Marigold “Goldie” Vance has an insatiable curiosity with dreams ,Hope Larson 
Injection  Vol. 3,Comics,An archaeological dig in Cornwall has gone very wrong  very quickly. And Maria Kilbride has her hands full already  as the effects of the Injection begin to dig in,Warren Ellis
Godshaper Vol. 1,Comics,Ennay is a man without a god. Bud is a god without a human. Together  they might just survive.In 1958  the laws of physics stopped working: ignition  electricity,Simon Spurrier 
Promise Me  Dad,NonFiction,A deeply moving memoir about the year that would forever change both a family and a country. In November 2014  thirteen members of the Biden family gathered on Nantucket for Thanksgiving,Joe Biden 
Prairie Fires,NonFiction,The first comprehensive historical biography of Laura Ingalls Wilder  the beloved author of the Little House on the Prairie book series Millions of readers of Little House on the Prairie ,Caroline Fraser 
It's All Relative,NonFiction,New York Times bestselling author of The Know-It-All and The Year of Living Biblically  A.J. Jacobs undergoes a hilarious  heartfelt quest to understand what constitutes family,A.J. Jacobs
Queen Victoria's Matchmaking,NonFiction,A captivating exploration of the role in which Queen Victoria exerted most international power and influence: as a matchmaking grandmother,Deborah Cadbury 
Women & Power,NonFiction,At long last  Mary Beard addresses in one brave book the misogynists and trolls who mercilessly attack and demean women the world over  including  very often,Mary Beard 
Mythos,NonFiction,The Greek myths are the greatest stories ever told  passed down through millennia and inspiring writers and artists as varied as Shakespeare,Stephen Fry 
Friends Divided,NonFiction,From the great historian of the American Revolution  New York Times-bestselling and Pulitzer-winning Gordon Wood  comes a majestic dual biography of two of America's most enduringly fascinating figures,Gordon S. Wood 
Mean,NonFiction,Myriam Gurba's debut is the bold and hilarious tale of her coming of age as a queer  mixed-race Chicana. Blending radical formal fluidity and caustic humor,Myriam Gurba
Black Tudors,NonFiction,A black porter publicly whips a white English gentleman in a Gloucestershire manor house. A heavily pregnant African woman is abandone,Miranda Kaufmann 
They Can't Kill Us Until They Kill Us,NonFiction,In an age of confusion  fear  and loss  Hanif Abdurraqib's is a voice that matters. Whether he's attending a Bruce Springsteen concert the day after visiting ,Hanif Willis-Abdurraqib 
Playing with Fire,NonFiction,From the celebrated host of MSNBC's The Last Word with Lawrence O'Donnell  an important and enthralling new account of the presidential election that changed everything,Lawrence O'Donnell 
The Mayflower,NonFiction,Rebecca Fraser's book about the Mayflower sheds new light on a family caught up in all the perils of crossing the ocean and settling in the wilderness,Rebecca Fraser
The Actor's Life,NonFiction,Jenna Fischer’s Hollywood journey began at the age of 22 when she moved to Los Angeles from her hometown of St. Louis. With a theater degree in hand,Jenna Fischer 
Where the Wild Coffee Grows,NonFiction,Coffee is one of the largest and most valuable commodities in the world. This is the story of its origins  its history  and the threat to its future ,Jeff Koehler 
Buzz,NonFiction,Once only whispered about in clandestine corners  vibrators have become just another accessory for the suburban soccer mom  showing up in all manner of pop culture,Hallie Lieberman
You Do You,NonFiction,From the New York Times bestselling author of The Life-Changing Magic of Not Giving a F*ck and Get Your Sh*t Together comes more straight talk,Sarah Knight
Counting Backwards,NonFiction,For many of the 40 million Americans who undergo anesthesia each year  it is the source of great fear and fascination. From the famous first demonstration of anesthesia in the Ether Dome at Massachusetts ,Henry Jay Przybylo 
The Planets,NonFiction,This magnificent volume offers a rich visual tour of the planets in our solar system. More than 200 breathtaking photographs from the archives of NASA are paired with extended captions,Nirmala Nataraj 
The Accidental President,NonFiction,The dramatic  pulse-pounding story of Harry Truman’s first four months in office  when this unlikely  small-town Washington outsider had to take on Germany  Japan  Stalin  and the atomic bomb,A.J. Baime 
Henry,NonFiction,When Katrina Shawver met the eighty-five year old Henry Zguda  he possessed an exceptional memory  a surprising cache of original documents and photos  and a knack for meeting the right people,Katrina Shawver
Here We Are Now,Music,Despite sending him letters ever since she was thirteen  Taliah Abdallat never thought she'd ever really meet Julian Oliver. But one day  while her mother is out of the country ,Jasmine Warga
Jacob's Ladder,Music,As the lead songwriter for Jacob’s Ladder  the last thing Gabe Renard needs is a debilitating case of writer’s block. After years of meaningless one night stands ,Katie Ashley
They Can't Kill Us Until They Kill Us,Music,In an age of confusion  fear  and loss  Hanif Abdurraqib's is a voice that matters. Whether he's attending a Bruce Springsteen concert the day after visiting Michael Brown's grave ,Hanif Willis-Abdurraqib 
Love on the Edge of Time,Music,He likes whiskey and wild women She likes Ben & Jerry’s He’s about to get kicked out of his own band She ate her way off the Miss America pageant circuit,Julie A. Richman
Manster,Music,I’m a rockstar on the run from the memories of my past. And pussies in palaces.   Record scratch. Rewind.   My name is Hudson Wyatt  and I raced cars until an injury ended my career.,Cari Quinn
Kneel ,Music,Dash Justice wrote the songs everyone sings. His face hangs on every girl’s wall. But Dash wasn’t always a rock God.,Eden Butler
David Bowie Made Me Gay,Music,Dash Justice wrote the songs everyone sings. His face hangs on every girl’s wall. But Dash wasn’t always a rock God. Once  he was just Jamie  the boy I loved,Eden Butler
Infamous,Music,All that up-and-coming musician Jesse Jamison has ever wanted is to be on the cover of Rolling Stone. When a gossip website nearly catches him kissing someone who isn’t his famous ,Jenny Holiday
Drive,Music,Music . . . the heart’s greatest librarian. The average song is three and a half minutes long; those three and a half minutes could lead to a slow blink  a glimpse of the past ,Kate Stewart
Trust Me ,Music,Gabe “Force” Banner’s life is in shambles. The only career he knows and wants is to be the drummer of Sole Regret  so he will try anything to get his band back together,Olivia Cunning
Lou Reed: A Life,Music,The essential biography of one of music's most influential icons: Lou ReedAs lead singer and songwriter for the Velvet Underground and a renowned solo artist  Lou Reed invented alternative rock. ,Anthony DeCurtis 
Sticky Fingers,Music,A delicious romp through the heyday of rock and roll and a revealing portrait of the man at the helm of the iconic magazine that made it all possible,Joe Hagan 
What Does This Button Do?: An Autobiography,Music,NEW YORK TIMES BESTSELLER A long-awaited memoir from the larger-than-life  multifaceted lead vocalist of Iron Maiden  one of the most successful  influential and enduring rock bands ever,Bruce Dickinson 
Tainted Butterfly ,Music,We have a history.From USA Today bestselling author Terri Anne Browning  comes a new ROCKER series—Tainted Knights.His childhood was full of darkness and all I have ever wanted was to give him the light,Terri Anne Browning 
Prince: A Private View,Music,Featuring a foreword by Beyoncé Knowles-Carter. Afshin Shahidi met Prince in 1993 and soon became his cinematographer and later one of the only people allowed to photograph him. ,Afshin Shahidi 
Bang ,Music,Book 5 in the Hard Rock Harlots Series Some people think touring with a bunch of hardcore rockers would be a dream come true. It isn't. Most days  life on the bus is more like a nightmare made fles,Kendall Grey
Mama Africa!,Music,Miriam Makeba  a Grammy Award–winning South African singer  rose to fame in the hearts of her people at the pinnacle of apartheid?a brutal system of segregation similar to American Jim Crow laws. ,Kathryn Erskine 
Marco Hietala - Stainless,Music,The Pioneer's Rude Story of Finnish Iron Metal. Marco is the bassist-soloist of Nightwish's most internationally successful band in Finland. As the founder of the legendary Tarot band ,Timo Kangasluoma 
The Peculiar Incident on Shady Street,Music,A girl unravels a centuries-old mystery after moving into a haunted house in this deliciously suspenseful mystery. Tessa Woodward isn’t exactly thrilled to move to rainy  ,Lindsay Currie
Things Are What You Make of Them,Music,Insights and inspiration for anyone who makes art (or anything else)  from the popular author of 1 Page at a Time and Pick Me Up From the creative mind and heart of Adam J. Kurtz ,Adam J. Kurtz
The Handmaid's Tale ,Feminism,Offred is a Handmaid in the Republic of Gilead. She may leave the home of the Commander and his wife once a day to walk to food markets whose signs are now pictures instead of words because women are no longer allowed to read. She must lie on her back once a month and pray that the Commander makes her pregnant  because in an age of declining births  Offred and the other Handmaids are valued only if their ovaries are viable. Offred can remember the years before  when she lived and made love with her husband  Luke; when she played with and protected her daughter; when she had a job  money of her own  and access to knowledge. But all of that is gone now, Margaret Atwood
The Bell Jar ,Feminism,Esther Greenwood is brilliant  beautiful  enormously talented  and successful  but slowly going under—maybe for the last time. In her acclaimed and enduring masterwork  Sylvia Plath brilliantly draws the reader into Esther's breakdown with such intensity that her insanity becomes palpably real  even rational—as accessible an experience as going to the movies. A deep penetration into the darkest and most harrowing corners of the human psyche  The Bell Jar is an extraordinary accomplishment and a haunting American classic. ,Sylvia Plath
Jane Eyre ,Feminism,Orphaned into the household of her Aunt Reed at Gateshead and subject to the cruel regime at Lowood charity school  Jane Eyre nonetheless emerges unbroken in spirit and integrity. She takes up the post of governess at Thornfield  falls in love with Mr. Rochester  and discovers the impediment to their lawful marriage in a story that transcends melodrama to portray a woman's passionate search for a wider and richer life than Victorian society traditionally allowed., Charlotte Brontë  Michael Mason
A Room of One's Own,Feminism,As relevant in its insight and indignation today as it was when first delivered in those hallowed lecture theatres  A Room of One’s Own remains both a beautiful work of literature and an incisive analysis of women and their place in the world.,Virginia Woolf
The Second Sex ,Feminism,Newly translated and unabridged in English for the first time  Simone de Beauvoir’s masterwork is a powerful analysis of the Western notion of “woman ” and a groundbreaking exploration of inequality and otherness.  This long-awaited new edition reinstates significant portions of the original French text that were cut in the first English translation. Vital and groundbreaking  Beauvoir’s pioneering and impressive text remains as pertinent today as it was sixty years ago  and will continue to provoke and inspire generations of men and women to come. , Simone de Beauvoir  H.M. Parshley
Pride and Prejudice,Feminism,“It is a truth universally acknowledged  that a single man in possession of a good fortune must be in want of a wife.” So begins Pride and Prejudice  Jane Austen’s witty comedy of manners—one of the most popular novels of all time—that features splendidly civilized sparring between the proud Mr. Darcy and the prejudiced Elizabeth Bennet as they play out their spirited courtship in a series of eighteenth-century drawing-room intrigues. Renowned literary critic and historian George Saintsbury in 1894 declared it the “most perfect  the most characteristic  the most eminently quintessential of its author’s works ” and Eudora Welty in the twentieth century described it as “irresistible and as nearly flawless as any fiction could be.”, Jane Austen
The Color Purple,Feminism,The Color Purple is a 1982 epistolary novel by American author Alice Walker which won the 1983 Pulitzer Prize for Fiction and the National Book Award for Fiction. It was later adapted into a film and musical of the same name., Alice Walker
The Yellow Wallpaper and Other Stories,Feminism,"Written from a feminist perspective  often focusing on the inferior status accorded to women by society  the tales include ""turned "" an ironic story with a startling twist  in which a husband seduces and impregnates a naïve servant; ""Cottagette "" concerning the romance of a young artist and a man who's apparently too good to be true; ""Mr. Peebles' Heart "" a liberating tale of a fiftyish shopkeeper whose sister-in-law  a doctor  persuades him to take a solo trip to Europe  with revivifying results; ""The Yellow Wallpaper""; and three other outstanding stories.",Charlotte Perkins Gilman
The Vagina Monologues,Feminism,I decided to talk to women about their vaginas  to do vagina interviews  which became vagina monologues...At first women were reluctant to talk. They were a little shy. But once they got going  you couldn't stop them. Women secretly love to talk about their vaginas. They get very excited  mainly because no one's ever asked them before., Eve Ensler
The Feminine Mystique,Feminism,Landmark  groundbreaking  classic—these adjectives barely do justice to the pioneering vision and lasting impact of The Feminine Mystique. Published in 1963  it gave a pitch-perfect description of “the problem that has no name”: the insidious beliefs and institutions that undermined women’s confidence in their intellectual capabilities and kept them in the home. Writing in a time when the average woman first married in her teens and 60 percent of women students dropped out of college to marry  Betty Friedan captured the frustrations and thwarted ambitions of a generation and showed women how they could reclaim their lives. Part social chronicle  part manifesto  The Feminine Mystique is filled with fascinating anecdotes and interviews as well as insights that continue to inspire. This 50th–anniversary edition features an afterword by best-selling author Anna Quindlen as well as a new introduction by Gail Collins. , Betty Friedan
I Know Why the Caged Bird Sings,Feminism,"Sent by their mother to live with their devout  self-sufficient grandmother in a small Southern town  Maya and her brother  Bailey  endure the ache of abandonment and the prejudice of the local ""powhitetrash."" At eight years old and back at her mother’s side in St. Louis  Maya is attacked by a man many times her age—and has to live with the consequences for a lifetime. Years later  in San Francisco  Maya learns that love for herself  the kindness of others  her own strong spirit  and the ideas of great authors (""I met and fell in love with William Shakespeare"") will allow her to be free instead of imprisoned.", Maya Angelou
The Awakening,Feminism,When first published in 1899  The Awakening shocked readers with its honest treatment of female marital infidelity. Audiences accustomed to the pieties of late Victorian romantic fiction were taken aback by Chopin's daring portrayal of a woman trapped in a stifling marriage  who seeks and finds passionate physical love outside the confines of her domestic situation., Kate Chopin
The Beauty Myth,Feminism,"The bestselling classic that redefined our view of the relationship between beauty and female identity. In today's world  women have more power  legal recognition  and professional success than ever before. Alongside the evident progress of the women's movement  however  writer and journalist Naomi Wolf is troubled by a different kind of social control  which  she argues  may prove just as restrictive as the traditional image of homemaker and wife. It's the beauty myth  an obsession with physical perfection that traps the modern woman in an endless spiral of hope  self-consciousness  and self-hatred as she tries to fulfill society's impossible definition of ""the flawless beauty."" ", Naomi Wolf 
Beloved ,Feminism,Staring unflinchingly into the abyss of slavery  this spellbinding novel transforms history into a story as powerful as Exodus and as intimate as a lullaby. , Toni Morrison
The 7 Habits of Highly Effective People: Powerful Lessons in Personal Change,Self-help,In The 7 Habits of Highly Effective People  author Stephen R. Covey presents a holistic  integrated  principle-centered approach for solving personal and professional problems. With penetrating insights and pointed anecdotes  Covey reveals a step-by-step pathway for living with fairness  integrity  service  and human dignity -- principles that give us the security to adapt to change and the wisdom and power to take advantage of the opportunities that change creates., Stephen R. Covey
How to Win Friends and Influence People,Self-help,Since its release in 1936  How to Win Friends and Influence People has sold more than 15 million copies. Dale Carnegie's first book is a timeless bestseller  packed with rock-solid advice that has carried thousands of now famous people up the ladder of success in their business and personal lives.,Dale Carnegie
The Reframe: Reframe Relationships,Self-help,The Reframe is a self-improvement book with the primary goal of attracting a desirable mate from a male's perspective. , Brian Maddox 
Oh  The Places You'll Go!,Self-help,In this joyous ode to life  Dr. Seuss addresses graduates of all ages  from nursery school to medical school  and gives them the get-up-and-go to move mountains with the unrivaled exuberance and charm that have made Dr. Seuss's books favorites for years., Dr. Seuss
Think and Grow Rich,Self-help,"This is the original 1937 version of Napoleon Hill's Classic Book: ""Think and Grow Rich"". To the greatest extent possible  the text and formatting have been kept exactly the same as in the original release with the exception of some minor formatting changes.", Napoleon Hill
Getting Things Done: The Art of Stress-Free Productivity,Self-help,In today's world  yesterday's methods just don't work. In Getting Things Done  veteran coach and management consultant David Allen shares the breakthrough methods for stress-free performance that he has introduced to tens of thousands of people across the country. Allen's premise is simple: our productivity is directly proportional to our ability to relax. Only when our minds are clear and our thoughts are organized can we achieve effective productivity and unleash our creative potential. In Getting Things Done Allen shows how to:, David Allen
